{
  "$schema": "https://json-schema.org/draft/2020-12/schema",
  "$id": "https://foodcenture.example/contracts/delivery.position.schema.json",
  "title": "FoodCenture: delivery.position v1",
  "type": "object",
  "additionalProperties": false,
  "required": [
    "eventId",
    "eventType",
    "version",
    "occurredAt",
    "traceId",
    "orderId",
    "payload"
  ],
  "properties": {
    "eventId": {
      "type": "string",
      "format": "uuid"
    },
    "eventType": {
      "type": "string",
      "const": "delivery.position"
    },
    "version": {
      "type": "integer",
      "const": 1
    },
    "occurredAt": {
      "type": "string",
      "format": "date-time"
    },
    "traceId": {
      "type": "string",
      "pattern": "^[0-9a-f]{32}$",
      "not": {
        "const": "00000000000000000000000000000000"
      }
    },
    "orderId": {
      "type": "string",
      "format": "uuid"
    },
    "payload": {
      "type": "object",
      "additionalProperties": false,
      "required": [
        "deliveryId",
        "courierId",
        "latitude",
        "longitude",
        "recordedAt",
        "sequence"
      ],
      "properties": {
        "deliveryId": {
          "type": "string",
          "format": "uuid"
        },
        "courierId": {
          "type": "string",
          "format": "uuid"
        },
        "latitude": {
          "type": "number",
          "minimum": -90,
          "maximum": 90
        },
        "longitude": {
          "type": "number",
          "minimum": -180,
          "maximum": 180
        },
        "recordedAt": {
          "type": "string",
          "format": "date-time"
        },
        "sequence": {
          "type": "integer",
          "minimum": 0
        }
      }
    }
  }
}
